{
  "schema_version": "veritas.decision_receipt.v1",
  "decision_id": "018f9b60-7e5a-7c40-9af3-4af9d7ccf001",
  "tenant_id": "tenant-example-001",
  "client_id": "client-app-001",
  "environment": "staging",
  "route": "/v1/inference/classify",
  "model_provider": "google_vertex_ai",
  "model_id": "gemini-1.5-pro-002",
  "model_version": "002",
  "policy_snapshot_hash": "sha256:aaaaaaaaaaaaaaaaaaaaaaaaaaaaaaaaaaaaaaaaaaaaaaaaaaaaaaaaaaaaaaaa",
  "input_hash_sha256":    "sha256:bbbbbbbbbbbbbbbbbbbbbbbbbbbbbbbbbbbbbbbbbbbbbbbbbbbbbbbbbbbbbbbb",
  "output_hash_sha256":   "sha256:cccccccccccccccccccccccccccccccccccccccccccccccccccccccccccccccc",
  "final_hash":           "sha256:dddddddddddddddddddddddddddddddddddddddddddddddddddddddddddddddd",
  "canonicalization": {
    "algorithm": "RFC8785_JSON_CANONICALIZATION",
    "version": "1.0"
  },
  "signature": {
    "algorithm": "ECDSA_P256_SHA256",
    "kms_key_version": "projects/example-project/locations/us-central1/keyRings/rex-guard/cryptoKeys/receipt-signing/cryptoKeyVersions/1",
    "public_key_ref": "projects/example-project/locations/us-central1/keyRings/rex-guard/cryptoKeys/receipt-signing/cryptoKeyVersions/1/publicKey",
    "signature_base64": "MEYCIQDEXAMPLE0000000000000000000000000000000000000000000000000000AiEA0000000000000000000000000000000000000000000000000000000000000000"
  },
  "chain": {
    "client_id": "client-app-001",
    "sequence_index": 1,
    "previous_hash": null,
    "current_hash": "sha256:dddddddddddddddddddddddddddddddddddddddddddddddddddddddddddddddd"
  },
  "ledger_status": "sealed",
  "latency_ms": 312,
  "created_at": "2026-05-02T10:00:00Z"
}
